{
  "$schema": "https://json-schema.org/draft/2020-12/schema",
  "$id": "https://github.com/Jinsongl/UQRA/schemas/adaptive-runner-config-v2.schema.json",
  "title": "UQRA adaptive runner configuration v2",
  "type": "object",
  "additionalProperties": false,
  "required": ["schema", "purpose", "scale", "runner", "output"],
  "properties": {
    "schema": {"const": "uqra.adaptive.runner-config/v2"},
    "purpose": {"const": "software_benchmark"},
    "scale": {"const": "reduced"},
    "runner": {
      "type": "object",
      "additionalProperties": false,
      "required": ["kind", "benchmark", "scenarios"],
      "properties": {
        "kind": {"const": "deterministic_benchmark"},
        "benchmark": {"enum": ["four_branch_reduced_v1", "phase8_two_dimensional_hermite"]},
        "scenarios": {
          "type": "array",
          "minItems": 1,
          "uniqueItems": true,
          "items": {
            "enum": ["converged", "max_order", "overfit_fallback", "reduced", "runtime_failure"]
          }
        }
      }
    },
    "output": {
      "type": "object",
      "additionalProperties": false,
      "required": ["manifest"],
      "properties": {"manifest": {"type": "string", "minLength": 1}}
    }
  }
}
