{
  "schema": "uqra.adaptive.runner-config/v2",
  "purpose": "software_benchmark",
  "scale": "reduced",
  "runner": {
    "kind": "deterministic_benchmark",
    "benchmark": "phase8_two_dimensional_hermite",
    "scenarios": ["converged"]
  },
  "output": {
    "manifest": "artifacts/examples/adaptive_registry_v2_smoke_manifest.json"
  }
}
