{
  "schema": "uqra.adaptive.runner-config/v2",
  "purpose": "software_benchmark",
  "scale": "reduced",
  "runner": {
    "kind": "deterministic_benchmark",
    "benchmark": "four_branch_reduced_v1",
    "scenarios": ["reduced"]
  },
  "output": {
    "manifest": "artifacts/examples/four_branch_reduced_v1_manifest.json"
  }
}
